{
  "$schema": "https://yen-gov.github.io/schemas/topic-catalogue.schema.json",
  "$schema_version": "1.2",
  "$comment": "Hand-authored taxonomy. Powers the Topic Front Door (/t, /t/:topic) and the section list inside each state hub (/s/:state). See ADR-0022 and TODO/IA-RESET-PLACE-FIRST-WITH-TOPIC-FRONT-DOOR.md. DOCTRINE (user-mandated 2026-05-11): elections are ONE indicator family among many. Social-welfare topics (fiscal, education, health, livelihood) are first-class; elections are not the spine and not the default theme. Order in this array IS the rendering order on /t and inside the state hub.",
  "sources": [],
  "topics": [
    {
      "id": "fiscal",
      "title": "Fiscal capacity",
      "list": "state",
      "summary": "How states raise, borrow, and spend. Debt, deficit, transfers from the Centre. The baseline that contextualises every other state-level number.",
      "icon": "landmark",
      "featured": true,
      "peer_set_default": "general_category",
      "artifacts": [
        {
          "kind": "indicator",
          "id": "fiscal/outstanding_debt_pct_gsdp",
          "default": true,
          "featured": true,
          "scope": "national"
        },
        {
          "kind": "indicator",
          "id": "fiscal/net_transfers_from_centre",
          "default": false,
          "featured": true,
          "scope": "national",
          "peer_set_default": "all"
        },
        {
          "kind": "indicator",
          "id": "fiscal/centre_transfers_gross",
          "default": false,
          "featured": false,
          "scope": "national",
          "peer_set_default": "all"
        },
        {
          "kind": "indicator",
          "id": "fiscal/centre_transfers_to_states_net",
          "default": false,
          "featured": false,
          "scope": "national"
        },
        {
          "kind": "indicator",
          "id": "fiscal/centre_transfers_to_states_tax_devolution",
          "default": false,
          "featured": false,
          "scope": "national"
        },
        {
          "kind": "indicator",
          "id": "fiscal/centre_transfers_to_states_grants",
          "default": false,
          "featured": false,
          "scope": "national"
        },
        {
          "kind": "indicator",
          "id": "fiscal/centre_transfers_to_states_gross",
          "default": false,
          "featured": false,
          "scope": "national"
        },
        {
          "kind": "indicator",
          "id": "fiscal/states_combined_gross_fiscal_deficit",
          "default": false,
          "featured": true,
          "scope": "national"
        },
        {
          "kind": "indicator",
          "id": "fiscal/states_combined_revenue_deficit",
          "default": false,
          "featured": false,
          "scope": "national"
        },
        {
          "kind": "indicator",
          "id": "fiscal/states_combined_primary_deficit",
          "default": false,
          "featured": false,
          "scope": "national"
        },
        {
          "kind": "indicator",
          "id": "fiscal/states_combined_primary_revenue_deficit",
          "default": false,
          "featured": false,
          "scope": "national"
        },
        {
          "kind": "indicator",
          "id": "fiscal/union_gross_fiscal_deficit",
          "default": false,
          "featured": true,
          "scope": "national"
        },
        {
          "kind": "indicator",
          "id": "fiscal/union_revenue_deficit",
          "default": false,
          "featured": false,
          "scope": "national"
        },
        {
          "kind": "indicator",
          "id": "fiscal/union_primary_deficit",
          "default": false,
          "featured": false,
          "scope": "national"
        },
        {
          "kind": "indicator",
          "id": "fiscal/union_primary_revenue_deficit",
          "default": false,
          "featured": false,
          "scope": "national"
        }
      ],
      "notes": "Debt and deficit are co-determined by central transfers — the transfers indicators (RBI Net via `fiscal/net_transfers_from_centre`, Rajya Sabha Gross via `fiscal/centre_transfers_gross`) are the contextualisation that makes ranked debt/deficit tables honest. Per ADR-0022 ingest gate. RBI Net covers FY24 Accounts + FY25 RE + FY26 BE; Rajya Sabha Gross covers FY17–FY23 (longer historical run, devolution + grants pre-adjustments). The all-India aggregate equivalent (RBI Net Centre→States transfers, FY08–FY26, 19y) is `fiscal/centre_transfers_to_states_net` — a country-entity series for the macro envelope view; its data shape is incompatible with the per-state choropleth (it carries one row per FY for `entity_id=\"IN\"`). The four `fiscal/states_combined_*_deficit` indicators (gross fiscal, revenue, primary, primary revenue) come from RBI Appendix Table 1 (Major Deficit Indicators) — same publication as the transfers, all-states aggregate, FY08–FY26 (20y including RE/BE). They answer the macro question 'how much are the states collectively borrowing each year, and what kind of borrowing is it?'. The matching `fiscal/union_*_deficit` quartet (RBI Handbook of Statistics on Indian Economy, Table 89, FY87–FY26 / 40y) ships the Centre's own borrowing as a peer family — without it, ranked deficit tables silently misframe responsibility (cf. Hans's chart-trap warning in docs/concepts/fiscal-actor-naming.md: states-combined GFD ~3% of GDP looks alarming until placed beside the Centre's ~6%)."
    },
    {
      "id": "energy",
      "title": "Energy",
      "list": "concurrent",
      "summary": "Where electricity is generated. Installed capacity by state, by fuel.",
      "icon": "zap",
      "featured": true,
      "peer_set_default": "all",
      "artifacts": [
        {
          "kind": "indicator",
          "id": "energy/installed_capacity_by_source_mw",
          "default": true,
          "featured": true,
          "scope": "national",
          "chart_type": "stacked-trend",
          "dimension": "power_source"
        },
        {
          "kind": "indicator",
          "id": "energy/installed_capacity_total_mw",
          "default": false,
          "featured": true,
          "scope": "national"
        },
        {
          "kind": "indicator",
          "id": "energy/installed_capacity_thermal_mw",
          "default": false,
          "featured": false,
          "scope": "national"
        },
        {
          "kind": "indicator",
          "id": "energy/installed_capacity_coal_mw",
          "default": false,
          "featured": true,
          "scope": "national"
        },
        {
          "kind": "indicator",
          "id": "energy/installed_capacity_gas_mw",
          "default": false,
          "featured": false,
          "scope": "national"
        },
        {
          "kind": "indicator",
          "id": "energy/installed_capacity_nuclear_mw",
          "default": false,
          "featured": false,
          "scope": "national"
        },
        {
          "kind": "indicator",
          "id": "energy/installed_capacity_hydro_mw",
          "default": false,
          "featured": false,
          "scope": "national"
        },
        {
          "kind": "indicator",
          "id": "energy/installed_capacity_renewable_mw",
          "default": false,
          "featured": true,
          "scope": "national"
        },
        {
          "kind": "indicator",
          "id": "energy/installed_mw_by_state",
          "default": false,
          "featured": false,
          "scope": "national"
        },
        {
          "kind": "indicator",
          "id": "energy/state_installed_capacity_geographical_mw",
          "default": false,
          "featured": true,
          "scope": "state"
        },
        {
          "kind": "indicator",
          "id": "energy/state_installed_capacity_with_alloc_mw",
          "default": false,
          "featured": false,
          "scope": "state"
        },
        {
          "kind": "indicator",
          "id": "energy/state_rooftop_solar_capacity_mw",
          "default": false,
          "featured": false,
          "scope": "state"
        },
        {
          "kind": "indicator",
          "id": "energy/state_electricity_generation_mu",
          "default": false,
          "featured": false,
          "scope": "state"
        },
        {
          "kind": "indicator",
          "id": "energy/state_electricity_peak_demand_mw",
          "default": false,
          "featured": false,
          "scope": "state"
        },
        {
          "kind": "indicator",
          "id": "energy/state_electricity_sales_mu",
          "default": false,
          "featured": false,
          "scope": "state"
        },
        {
          "kind": "indicator",
          "id": "energy/state_atc_losses_pct",
          "default": false,
          "featured": true,
          "scope": "state"
        },
        {
          "kind": "indicator",
          "id": "energy/state_acs_arr_gap_inr_per_kwh",
          "default": false,
          "featured": false,
          "scope": "state"
        }
      ],